{
  "L": 0.22628,
  "d_tip": 0.007139,
  "phi_deg": 6.3,
  "Delta_theta_deg": 30.78,
  "terminal_unit_policy": "exact_requested_length",
  "n_cables": 4,
  "tendon_inward_shift": 0.0015,
  "show_preview": false,
  "notch_factor": 0.25,
  "nlobe_t": 0.5,
  "post_gen": {
    "_comment": "All post_gen fields are optional. Omit any to keep the pipeline default.",
    "robot_pos": [
      0,
      0,
      0.22628
    ],
    "robot_quat": [
      0,
      0,
      -1,
      0
    ],
    "joint_stiffness_base": 0.2,
    "joint_damping_base": 0.01,
    "joint_beta": 1.03,
    "first_joint_stiffness": 100,
    "first_joint_damping": 50,
    "tip_site_pos": [
      0,
      0,
      0.005
    ],
    "timestep": 0.0001
  },
  "build": {
    "collision_mode": "convex",
    "mesh_layout": "shared"
  }
}
